{
  "schema": "healthrelay.intake-context",
  "schema_version": "1.0",
  "batch_id": "5f0e8a2c-6d41-4b0e-9c3a-7a1d2b9e4f10",
  "producer_id": "nutrition-app",
  "writer_bundle_id": "com.example.healthrelay.nutrition",
  "installation_id": "507b8fbb-78d3-450c-a88f-487e90df92e6",
  "operations": [
    {
      "operation_id": "c1f4a7d2-93be-4e65-8d0a-2b6f1e7c9a35",
      "operation": "delete",
      "intake_id": "e6677963-418c-4027-b563-551d8a531eed",
      "revision": 3,
      "deleted_at": "2026-09-30T18:05:00Z",
      "domain_facts_hash": "sha256:d5eb957cbb1c1c723739f5c7f510532b1e85bc593826faa0f6baf22da3ee6c6f",
      "client_payload_hash": "sha256:f1964b61cfe577bca536102ae356ec8db4227e7ecd19c6250ab9dcf2c3c39cc4"
    }
  ]
}
